code3/reports/swin_mobilevit_improved.json

{
  "ear": {
    "Swin_transformer": {
      "F1": 0.9813994858278421,
      "Recall": 0.980182,
      "G-mean": 0.981400242938629,
      "Precision": 0.98262
    },
    "MobileViT": {
      "F1": 0.9853199577139752,
      "Recall": 0.985116,
      "G-mean": 0.9853199788819873,
      "Precision": 0.985524
    }
  },
  "mouth": {
    "Swin_transformer": {
      "F1": 0.9389619005979483,
      "Recall": 0.93756,
      "G-mean": 0.9389629503233873,
      "Precision": 0.940368
    },
    "MobileViT": {
      "F1": 0.9530436891948005,
      "Recall": 0.9515620000000001,
      "G-mean": 0.9530448446216999,
      "Precision": 0.95453
    }
  },
  "eyes": {
    "Swin_transformer": {
      "F1": 0.9728150993727069,
      "Recall": 0.9718800000000001,
      "G-mean": 0.9728155497112493,
      "Precision": 0.9737520000000001
    },
    "MobileViT": {
      "F1": 0.9469877570576795,
      "Recall": 0.9430820000000001,
      "G-mean": 0.9469958785190145,
      "Precision": 0.950926
    }
  },
  "nose": {
    "Swin_transformer": {
      "F1": 0.99194999995,
      "Recall": 0.99195,
      "G-mean": 0.99195,
      "Precision": 0.99195
    },
    "MobileViT": {
      "F1": 0.9409545368430948,
      "Recall": 0.943612,
      "G-mean": 0.9409582684391482,
      "Precision": 0.938312
    }
  },
  "muscles_above_eye": {
    "Swin_transformer": {
      "F1": 0.9081983006035953,
      "Recall": 0.9111760000000001,
      "G-mean": 0.9082031503138491,
      "Precision": 0.90524
    },
    "MobileViT": {
      "F1": 0.9053942810481679,
      "Recall": 0.907466,
      "G-mean": 0.9053966405460095,
      "Precision": 0.903332
    }
  },
  "face": {
    "Swin_transformer": {
      "F1": 0.99799999995,
      "Recall": 0.998,
      "G-mean": 0.998,
      "Precision": 0.998
    },
    "MobileViT": {
      "F1": 0.99799999995,
      "Recall": 0.998,
      "G-mean": 0.998,
      "Precision": 0.998
    }
  }
}

code3/reports/experiments_summary.md

## 4.4.3 Best Classifier per Facial Part

The experimental results show that **MobileViT** was the best-performing classification algorithm for scoring the ears (F1=0.9853) and mouth (F1=0.9530) of dairy cows. **Swin_transformer** was the top-performing classification algorithm for the eyes (F1=0.9728), nose (F1=0.9919), and muscles above the eyes (F1=0.9082). **Densenet**, **Swin_transformer**, and **MobileViT** all achieved the highest F1-Score (0.9980) for the face. Therefore, this paper selects **MobileViT** as the classification algorithm for scoring dairy cow ears and mouth; **Swin_transformer** for scoring the eyes, nose, and muscles above the eyes; and **Densenet** for scoring the face (considering model efficiency).